{
  "format": "test-parrot/exam",
  "formatVersion": "0.4.0",
  "name": "Unit 3 Quiz",
  "sections": [
    {
      "title": "Objective",
      "instructions": "Write the letter, or T or F, on the blank."
    },
    {
      "title": "Short Answer",
      "instructions": "Answer on the lines."
    }
  ],
  "paperStyle": "classic",
  "positions": [
    {
      "question": {
        "bank": "bank",
        "question": "q1"
      },
      "section": 0,
      "columns": 2
    },
    {
      "question": {
        "bank": "bank",
        "question": "q3"
      },
      "section": 0
    },
    {
      "question": {
        "bank": "bank",
        "question": "q4"
      },
      "section": 0
    },
    {
      "question": {
        "bank": "bank",
        "question": "q2"
      },
      "section": 0
    },
    {
      "question": {
        "bank": "bank",
        "question": "q5"
      },
      "section": 1,
      "workSpace": {
        "height": 0,
        "style": "blank",
        "fill": false
      }
    }
  ]
}
